{
  "schema_version": 1,
  "manifest_id": "GEF.LESSON_SYSTEM",
  "canonical_sources": {
    "lesson_truth_repo": "Clickabl/gef-lexicon",
    "language_registry": "Clickabl/gef-expo/registry/language-support.json",
    "corpus_evidence_repo": "Clickabl/gef-content",
    "runtime_repo": "Clickabl/gef-expo",
    "agent_queue_contract": "Clickabl/gef-expo/docs/product/schemas/agent-review-task-v1.schema.json"
  },
  "status_model": {
    "integrity_review_states": ["candidate", "approved", "superseded", "rejected"],
    "release_stages": ["machine_created", "machine_verified", "general_public", "education"],
    "release_order": ["machine_created", "machine_verified", "general_public", "education"],
    "public_beta_minimum": "machine_verified",
    "notes": "Integrity review and release readiness are independent dimensions. Schema validation or machine verification never changes review_state to approved."
  },
  "coverage_policy": {
    "language_registry_ref": "Clickabl/gef-expo/registry/language-support.json",
    "language_program_pointer": "/programs/learnFromLanguages",
    "counts_must_be_derived": true,
    "directional_pairs": true,
    "completeness_tiers": ["core", "full"],
    "core_all_language_invariant": "Every canonical vocabulary/concept required by a lesson part must have a resolvable lexicon realization or an explicit researched no-direct-equivalent record for every language in the canonical learn-from language program before that part may claim all-language Core coverage.",
    "tier3_core_policy": "Tier 3 targets may provide Core comparison, recognition-safe games, reader quests, and annotated-reading discovery when the required concept coverage exists. This does not make them full grammar-learning targets.",
    "full_grammar_policy": "Full grammar instruction is limited by the canonical language-support registry. At the current registry contract that means Tier 1 and selectively Tier 2, never Tier 3 merely because Core exists."
  },
  "component_catalog": [
    {"component_id":"lexicon_concepts","required_for":["core","full"],"notes":"Core cannot claim all-language coverage until every required concept resolves across the canonical learn-from program."},
    {"component_id":"intro_blurb","required_for":["core","full"]},
    {"component_id":"examples","required_for":["full"]},
    {"component_id":"ui_interactions","required_for":["core","full"]},
    {"component_id":"practice","required_for":["full"]},
    {"component_id":"game","required_for":["core","full"],"notes":"Core may use recognition-safe games even when production grammar practice is unavailable."},
    {"component_id":"quest","required_for":["core","full"]},
    {"component_id":"default_reading","required_for":["core","full"]},
    {"component_id":"annotations","required_for":["core","full"],"notes":"Corpus-side annotations live in gef-content and point back to lexicon concepts/lesson parts."},
    {"component_id":"related_lessons","required_for":["full"]},
    {"component_id":"learning_path","required_for":["core","full"]},
    {"component_id":"cefr_target","required_for":["core","full"]}
  ],
  "readiness_resolution": {
    "precedence": ["part_default", "tier_override", "source_language_override", "target_language_override", "pair_override"],
    "summary_is_derived": true,
    "pair_matrix_is_materialized": false,
    "notes": "Resolve each directional source-language to target-language view at read time. Exact pair overrides win. A dashboard may aggregate the resolved matrix, but generated summary rows are cache/projection data, never lesson truth. Any required component omitted from a readiness profile resolves as missing unless a more-specific override supplies it."
  },
  "lesson_groups": [
    {
      "group_id": "GROUP.meta.language_levels",
      "title": "International language levels",
      "gold_standard": false,
      "family_refs": [],
      "parts": [
        {
          "part_id": "PART.meta.language_levels.orientation",
          "title": "How international language levels work",
          "implementation_lesson_ids": ["LES.mul.meta.international_language_levels"],
          "implementation_status": "implemented",
          "cefr": {"default":"mixed","notes":"Orientation spans the full proficiency scale rather than teaching at one language-production level."},
          "prerequisite_part_ids": [],
          "core_concept_refs": ["proficiency/frameworks.json","proficiency/gef-scale.json"],
          "quest": {"status":"not_applicable","notes":"This meta orientation intentionally has no reader quest."},
          "default_reading": {"status":"not_applicable","notes":"This is a product-orientation lesson rather than a corpus-anchored language lesson."},
          "ui_component_refs": [],
          "readiness": {
            "default": {
              "available_tier":"full",
              "release_stage":"machine_verified",
              "review_state":"approved",
              "components": {
                "lexicon_concepts":{"release_stage":"machine_verified","review_state":"approved","status":"ready","source_ref":"proficiency/frameworks.json"},
                "cefr_target":{"release_stage":"machine_verified","review_state":"approved","status":"ready","source_ref":"lessons/mul/international-language-levels/lesson.json"},
                "learning_path":{"release_stage":"machine_created","review_state":"candidate","status":"partial","source_ref":"curriculum/learning-path-template.json"}
              },
              "notes":"Approved integrity state is preserved; general-public/education release is not inferred without an explicit release decision."
            }
          },
          "gaps": ["Explicit release-stage promotion decision remains separate from integrity approval."]
        }
      ],
      "related_lessons_ref": "curriculum/related-lessons.json"
    },
    {
      "group_id": "GROUP.family",
      "title": "Family and relationships",
      "gold_standard": false,
      "family_refs": ["lesson-families/family-members/family.json"],
      "parts": [
        {
          "part_id":"PART.family.members",
          "title":"Family members",
          "implementation_lesson_ids":["LES.mul.vocab.family_members"],
          "implementation_status":"implemented",
          "cefr":{"default":"A1"},
          "prerequisite_part_ids":[],
          "core_concept_refs":["lesson-families/family-members/game-vocabulary/manifest.json","lesson-families/family-members/language-capabilities.json"],
          "quest":{"status":"required_missing","notes":"Teacher quest policy exists, but no canonical reader quest binding is present in the lesson definition."},
          "default_reading":{"status":"required_missing","notes":"gef-content must bind a reviewed default annotated reading."},
          "ui_component_refs":[],
          "readiness":{"default":{"available_tier":"core","release_stage":"machine_created","review_state":"candidate","components":{"lexicon_concepts":{"release_stage":"machine_created","review_state":"candidate","status":"partial","source_ref":"lesson-families/family-members/game-vocabulary/manifest.json"},"game":{"release_stage":"machine_created","review_state":"candidate","status":"ready","source_ref":"lessons/mul/family-members/lesson.json"},"quest":{"release_stage":"machine_created","review_state":"candidate","status":"missing"},"default_reading":{"release_stage":"machine_created","review_state":"candidate","status":"missing"},"annotations":{"release_stage":"machine_created","review_state":"candidate","status":"partial"}}},"tier_overrides":[{"source_tier":"any","target_tier":"tier3_read_games","readiness":{"available_tier":"core","release_stage":"machine_created","review_state":"candidate","notes":"Recognition-safe 14-concept game core exists; this is not Full grammar/culture support."}}]},
          "gaps":["Bind a quest.","Bind a default annotated reading.","Prove all canonical concept coverage across the derived learn-from language set before claiming all-language Core."]
        },
        {
          "part_id":"PART.family.describe",
          "title":"Describe your family",
          "implementation_lesson_ids":["LES.mul.vocab.describe_family"],
          "implementation_status":"implemented",
          "cefr":{"default":"A1"},
          "prerequisite_part_ids":["PART.family.members"],
          "core_concept_refs":["lesson-families/family-members/family-path.json"],
          "quest":{"status":"required_missing"},
          "default_reading":{"status":"required_missing"},
          "ui_component_refs":[],
          "readiness":{"default":{"available_tier":"core","release_stage":"machine_created","review_state":"candidate"}},
          "gaps":["Quest missing.","Default annotated reading missing.","All-language Core concept coverage must be proven."]
        },
        {
          "part_id":"PART.family.extended",
          "title":"Extended family",
          "implementation_lesson_ids":["LES.mul.vocab.extended_family"],
          "implementation_status":"implemented",
          "cefr":{"default":"A1","notes":"Language-specific overrides may move this substantially later when kinship systems require more distinctions; no override is invented without research."},
          "prerequisite_part_ids":["PART.family.describe"],
          "core_concept_refs":["lesson-families/family-members/family-path.json"],
          "quest":{"status":"required_missing"},
          "default_reading":{"status":"required_missing"},
          "ui_component_refs":[],
          "readiness":{"default":{"available_tier":"core","release_stage":"machine_created","review_state":"candidate"}},
          "gaps":["Quest missing.","Default annotated reading missing.","Language-specific CEFR/path overrides require research."]
        },
        {
          "part_id":"PART.family.relationships",
          "title":"Relationships and family life",